{
  "schema_version": "0.1",
  "branch_id": "branch_root_2026_04_main",
  "root_id": "root_2026_04",
  "parent_branch_id": null,
  "character_id": "yy",
  "created_at": "2026-04-01T00:00:00Z",
  "status": "active",
  "state": {
    "story_day": 14,
    "condition": {
      "health": 0.86,
      "hunger": 0.41,
      "attention": 0.62
    },
    "inventory": [
      "bottle_cap",
      "string",
      "half_cracker"
    ],
    "active_burdens": [
      "worry_about_winter_cache"
    ],
    "goals": {
      "primary": "find_useful_things",
      "secondary": "stay_near_friends"
    },
    "reaction_overrides": {
      "danger": "run",
      "joke": "laugh"
    },
    "trait_deviations": {
      "disciplined": 0.05,
      "curious": -0.03
    },
    "identity_notes": [
      "a little more alert than usual this week"
    ]
  },
  "drift_flags": [],
  "last_updated_at": "2026-04-14T23:59:00Z"
}
